stock,date,title,label
TM,2017-08-01,Detroit's Big 3 See Big Declines: July Auto Sales Roundup; Toyota Reports North American Auto Sales Up 3.6% In Jul.,1
AZN,2015-06-02,"Juno Shares Falling; May be Attributed to Bloomberg Correcting Earlier Story of AstraZeneca CEO Saying Would Buy Co Such as Juno; Report: AstraZeneca Might Bid On Juno Therapeutics; AstraZeneca CEO Soriot Said CAR T Therapy Candidates Would Need to Be Able to Manage Side Effects Before Co. Would Be Interested in Deal; Hearing AstraZeneca CEO Pascal Soriot Has Suggested Co. 'Would Consider' Cos. Like Juno, Will Partner for Further Immunotherapy Trials; Shares of Ziopharm, Juno Moving Higher; Note Being Circulated Says Juno, Ziopharm Potential Targets of AstraZeneca",1
STLD,2014-08-18,Pete Najarian Sees Unusual Options Activity In Steel Dynamics; Morgan Stanley: Steel Production Near Its Peak,2
COF,2016-10-04,Why Capital One's Decelerating Card Growth Is A Good Thing; Implications Of Bass Pro Shops' Cabela's Partnership With Capital One; Cabela's Downgraded By Barclays Following Monday's 15% Rally,1
ACC,2012-10-22,"American Campus Communities Reports Q3 EPS $0.32 vs $0.37 Est; Revenues $118.8M vs $119.66M Est; Earnings Scheduled For October 22, 2012",1
DKS,2016-06-30,"Dick's Sporting Goods Confirms it was Successful Bidder for  Sports Authority's IP Assets, Right to Acquire 31 Store Leases; UPDATE: Dick's Offer for Sports Authority IP, Name was $15M, Bid $8M for Store Leases; Hearing Dick's Could Win Auction of IP Assets of Sports Authority",2
TIPT,2014-04-03,UPDATE: Tiptree Financial Says Has No Idea What is Causing the Move in the Stock Price; Tiptree Financial Says Was Contacted by Nasdaq Regarding Stock Activity,1
STLD,2017-03-17,15 Biggest Mid-Day Gainers For Friday; Mid-Morning Market Update: Markets Edge Higher; Tiffany Earnings Top Estimates; 20 Stocks Moving In Friday's Pre-Market Session,1
CNX,2011-06-21,"Basic Materials Sector On Fire; S&P Sector Update: Basic Materials Leading 2.4%, Utilities Lagging 0.15%",2
STLD,2016-03-11,U.S. Metals: Balancing A Constructive Domestic Macro Environment Against China Risks; Credit Suisse Bullish On Steel Sector,1
AT,2014-11-17,Mid-Afternoon Market Update: Tyson Rises After Q4 Results; DreamWorks Shares Decline; Mid-Day Market Update: Allergan Jumps On Actavis Bid; Denbury Resources Shares Slip,1
ETN,2013-02-25,"UPDATE: Credit Suisse Initiates Eaton Corporation at Outperform on CBE Deal; Benzinga's Top Initiations; Credit Suisse Initiates Coverage on Eaton Corporation at Outperform, Announces $72.00 PT",0
KEY,2012-01-24,"Earnings Roundup; UPDATE: KeyCorp Reports Upbeat Q4 Earnings; KeyCorp Reports Q4 EPS $0.21 vs $0.20 Est; Revenues $977M vs $1.00B Est	 				; US Stock Futures Down; McDonald's, Johnson & Johnson In Focus; Earnings Scheduled For January 24",1
RLI,2016-01-25,"Earnings Recap For January 25; UPDATE: RLI Corp Reports Q4 Revs $207.3M Vs Est $165.91M; RLI Reports Q4 EPS $0.56 vs. Est. $0.64; Earnings Scheduled For January 25, 2016",1
SYNL,2015-07-13,Synalloy Names New Dennis M. Loughran AS CFO & Sr. VP; Synalloy Names Dennis Loughran as New CFO,1
CBG,2013-03-19,"Benzinga's M&A Chatter for Tuesday March 19, 2013; CBRE Group Acquires IMPACT-CORTI ",0
CASH,2016-10-27,"4 Stocks That Rallied For Three Days On Increasing Volume, No News; 12 Stocks Which Rallied Three Days On Increasing Volume",1
SNY,2016-08-29,"Novogen Names Gordon Hirsch as Chief Medical Officer; Regeneron, Sanofi Present Positive Phase 3 Investigational Data for Praluent Injection in Patients Undergoing LDL Apheresis Therapy at ESC Congress 2016",1
PRGS,2012-06-27,"Progress Software Says Not Guiding Q3 on Disruption; Progress Software Reports Q2 EPS $0.21 vs $0.17 Est, Revenue $114.6M vs $112.37M Est; Earnings Scheduled For June 27",2
TEO,2015-09-28,"Goldman Cuts Telecom Argentina To Sell: Here's Why; Goldman Sachs Downgrades Telecom Argentina to Sell, Lowers PT to $14.00, Says Fundamentals Are Deteriorating",0
AVA,2014-12-22,"Benzinga's Top Upgrades; UBS Upgrades Avista To Neutral; UBS Upgrades Avista to Neutral, Raises PT to $34.00",1
STLD,2015-04-14,"Analyst Sees Steel-Dumping Case On Horizon, Launches Sector Coverage; Clarkson Capital Markets Initiates On Metals & Miners",2
CPST,2014-07-31,Capston Turbine Announces First Order For C600 Product; Capstone Announces C600 Order from Sarlin Oy Ab for First C600 Landfill Project in Finland ,1
TM,2016-06-02,"OPEC Production Debate and European Rates In Focus Ahead of U.S. Jobs; Goldman Reviews May Auto Sales, Says May Light Vehicle SAAR In Line",1
HALO,2013-06-28,Afternoon Market Gainers; Halozyme Spikes Higher; Halozyme Announces Positive Opinion from CHMP on Roche's Herceptin SC for European Approval; Halozyme Therapeutics Announces Positive Opinion from CHMP On Roche's Herceptin SC for European Approval,2
TM,2010-08-30,"Toyota Motor (TM) “stalls” amid continued recall news; Japanese Stocks End Monday Up 1.8% (EWJ, EWV, TM, PC)",1
AVY,2016-07-01,9 Biggest Mid-Day Losers For Friday; Benzinga's Top Downgrades; Bank of America Downgrades Avery Dennison to Underperform,1
COF,2017-05-01,"Free Credit Report: Deutsche Bank Likes Capital One, Downgrades Discover; Benzinga's Top Upgrades, Downgrades For May 1, 2017; Deutsche Bank Upgrades Capital One Financial to Buy",1
SNY,2012-12-12,"Benzinga's M&A Chatter for Wednesday December 12, 2012; Hearing Unconfirmed Chat Room Chatter in Dendreon Regarding Possible Sanofi Bid",1
TM,2012-01-05,Japan Automobile Sales Surge In December; Toyota Projects 32% Surge In 2012 Sales In India,1
CPST,2016-04-11,"Capstone Reports Securing of 8MW in Orders for Multiple Projects in Indonesia, Malaysia; Capstone Secures 8MW of Orders for Multiple Projects in Indonesia and Malaysia",2
GGP,2013-09-13,"Amended 13G from Pershing Square on General Growth Properties Shows 3.7% Stake; General Growth Properties Reports Common Share Repurchase from Pershing Square, 25M Shares at $20/Share on Sept. 12th",1
DG,2011-11-11,"Can Nordstrom ""Reinvent Itself?""; Target Earnings Preview: Analysts Expect Flat EPS, Rising Revenue",2
HNP,2016-04-18,Mid-Afternoon Market Update: Chiasma Tumbles Following FDA Review; Cvent Shares Spike Higher; Mid-Day Market Update: US Stocks Turn Positive; Hasbro Shares Gain Following Earnings Beat; Citigroup Downgrades Huaneng Power to Sell,1
NRG,2015-11-04,"Mid-Morning Market Update: Markets Mostly Flat; Time Warner Beats Q3 Views; NRG Energy Reports Q3 EPS $0.18 May Not Compare, Revs $4.43B Vs Est $4.24B",1
STLD,2016-03-23,"Be Warned Metals Investors: Deutsche Bank Just Moved To The Sidelines; These Steel Numbers Just 'Escalated Quickly,' Are You Buying?; KeyBanc Maintains Overweight on Steel Dynamics, Raises PT to $25.00; Credit Suisse Maintains Outperform on Steel Dynamics, Raises PT to $27.00",1
SNV,2010-01-06,"The Commercial Real Estate Collapse (MI, SNV); Investment Strategy for Banking Stocks in 2010 (FITB, FCNCA, NYB, SNV)",2
MTOR,2013-04-30,"Mid-Afternoon Market Update: CNH Global Plummets as Oil States International Rallies; Mid-Day Market Update: Markets Shed Losses, Nuance Falls On Weak Results; Meritor, Inc. Reports Q1 EPS of $0.06 vs $0.05 Est; Revenue of $908.0M vs $914.0M Est",2
STLD,2011-10-05,"Resistance  10-05-2011; TARP ""EU""  10-05-2011; Five Stocks The Street is Buying; Notable Call Options Activity in Steel Dynamics",2
GWPH,2017-03-28,"Rapper 'The Game' Talks About His Cannabis Venture: 'Setting The Standard For Quality Medicine, Patient Care'; 'Trump Schmump': H.C. Wainwright Raises Zynerba's Target To $30",1
TM,2014-04-28,"Report: Toyota Joining Corporate Exodus Out Of California, Moving U.S. HQ To Texas; UPDATE: Toyota's HQ Move Will Impact ~4K Workers; Toyota Says Will Establish New North American HQ, Three HQs Will Relocate to Plano, Texas, NA Finance Unit Will Also Relocate to Plano; Toyota to Consolidate US Operations In Texas Hub, Which Will House 4,000 Workers -DJ; Top 4 Large-Cap Stocks In The Auto Manufacturers-Major Industry With The Highest EPS",1
NBL,2011-12-07,"UPDATE: Sterne Agee Reiterates Buy, Raises PT to $117 on Noble Energy ; Sterne Agee Raises PT on Noble Energy to $117",0
CNX,2012-07-02,"CONSOL Energy Sells Northern Powder River Basin Assets for $170 million in Cash, While Retaining an 8% Production Royalty ; CONSOL Energy Sells Northern Powder River Basin Assets for $170M in Cash, While Retaining an 8% Production Royalty  ",1
GWPH,2015-03-16,GW Pharmaceuticals Continues To Rally: A Technical Look; Marijuana: What A Difference Two Decades Makes,2
MDCO,2011-10-03,The Medicines Company Launches New Formulation of Cleviprex Injectable Emulsion  ; Citigroup Raises PT on The Medicines Company to $24; Pre-Market Movers; The Medicines Company up 10%; The Medicines Company Settles Angiomax Patent Litigations With Teva  ,1
AEG,2010-06-10,"Benzinga’s Top Downgrades (AEG, ANDS, AZO, PNM); Keefe Bruyette Downgrades AEG To Market Perform",2
KEY,2014-12-09,"Benzinga's Top Initiations; Guggenheim Securities Initiates KeyCorp At Buy; Guggenheim Securities Initiates Coverage on KeyCorp at Buy, Announces $16.00 PT",1
JWN,2014-05-23,UPDATE: Nordstrom News Crossed the Wires Yesterday; Nordstrom Said to Make Informal Approach to Potential Buyers of Cards Unit -Bloomberg; Nordtrom Spikes Higher,1
EGAN,2014-09-03,"NASDAQ Tumbles 0.5%; Infinity Pharmaceuticals Jumps On Deal With AbbVie; Markets Gain; Toll Brothers Profit Beats Estimates; eGain Communications Reports Q4 EPS of $(0.04) vs $0.00 Est; Revenue of $18.90M vs $19.48M Est; Earnings Scheduled For September 3, 2014",0
ETN,2017-02-03,"7 Biggest Price Target Changes For Friday; Benzinga's Top Upgrades, Downgrades For February 3, 2017; JP Morgan Downgrades Eaton CorporationTo Neutral, Lowers Price Target To $70",1
WLH,2017-09-13,"William Lyon Homes Prices ~3.32M Share Common Stock Offering Via Paulson & Co., No Price Specified; William Lyon Homes Announces Secondary Offering 3,322,666 Shares Common Stock",1
EROS,2016-12-09,Benzinga's Volume Movers; Wells Fargo Upgrades Eros International PLC A Ordinary Shares to Outperform,1
MDCO,2015-11-13,"Federal Circuit Overturns Decision On Angiomax Patients, The Medicines Company Request For Rehearing of Appeal; Medicine's Company Angiomax Patent Invalidation Vacated by U.S. Court of Appeals for the Federal Circuit; Medicines Co Spikes Higher",2
GWPH,2015-10-27,"13 Stocks To Watch In The Healthcare Space; GW Pharmaceuticals, Otsuka Announce Results from Two Remaining Sativex Phase 3 Cancer Pain Trials; Consistent With Previously Announced Results from Initial Phase 3 Trial, Remaining Trials Fail to Show Superiority Over Placebo; GW Pharmaceuticals and the Government of New South Wales Report a Strategic Agreement to Study Epidiolex and CBDV in a Clinical Trial and Research Program for Children With Epilepsy",1
IMPV,2016-09-26,Option Alert: IMPV Oct $55 Call @Bid @$1.20; Benzinga's Top Downgrades; Nomura Downgrades Imperva to Neutral,1
NBL,2014-02-24,"Benzinga's Top Initiations; KLR Group Initiates Coverage on Noble Energy Inc. at Buy, Announces $91.00 PT",2
NRG,2010-12-15,NRG Energy Acquires Solar Unit - Analyst Blog; NRG Energy Acquires Solar Unit - Analyst Blog; Wunderlich Maintains Buy On NRG Energy (NRG),1
GD,2011-11-14,"General Dynamics Awarded $41.6M Navy Contract; Berkshire Discloses Stake in Directv, General Dynamics",1
RENN,2017-06-21,"Renren Sees Q2 Sales $21.5M to $23.5M; Renren Q1 EPS $(0.24) vs $(0.34) YoY, Sales $20.9M vs $10.8M YoY",1
GD,2011-01-13,Citigroup Upgrades General Dynamics to Buy (GD); Citigroup Upgrades General Dynamics To Buy,1
MDCO,2014-10-22,From The Medicines Company Earnings Conference Call: Sees FY2014 Sales $720.0M-735.0M vs $750.0M Est; Medicines Co. See Charges Of $10M to $14M In Q4; Cite Restructuring For Reason,1
WNS,2012-08-13,"UPDATE: JP Morgan Upgrades WNS Holdings Limited to Neutral on Restructuring Results  ; JP Morgan Upgrades WNS (Holdings) Limited (ADR) from Underweight to Neutral, Maintains PT at $12",0
EFX,2016-04-08,Benzinga's Top Initiations; William Blair Initiates Coverage on Equifax at Outperform,1
JWN,2010-06-22,"Time To Get Short Retail (XRT, JWN, M, BBBY, ANF) ; Stock Market News for June 22, 2010 - Market News",0
AEZS,2013-03-21,"AEterna Zentaris Inc. Reports Q4 EPS of $(0.29) vs $(0.31) Est; Revenue of $9.55M vs $7.96M Est; Earnings Scheduled For March 21, 2013",2
CHSP,2016-01-19,"Hotel REIT Sector Downgraded To Sell At Ladenburg; Stocks Hitting 52-Week Lows; Ladenberg Downgrading Hotel REITs, Believes Steep Downside Remains Despite Recent Heavy Selloff; Ladenburg Thalmann Downgrades Chesapeake Lodging Trust to Sell",0
STLD,2016-04-20,"Steel Dynamics Reports Q1 EPS $0.26 Vs Est $0.24, Sales $1.74B Vs Est $1.71B; Earnings Scheduled For April 20, 2016",1
NAV,2012-07-12,"UPDATE: Carl Icahn Increases Stake in Navistar International; CVS, Navistar and Other Stocks Insiders Are Buying",2
ELGX,2012-05-30,Endologix Files Mixed-Secrities Shelf; Endologix Announces Public Offering of 2.7 Million Shares of Common Stock ,1
GWPH,2015-04-27,"GW Pharma Announces Proposed Offering of 1.25M ADSs; Did The AAN Meeting Affect Biogen, PTC Therapeutics, GW Pharma Or Isis Pharma?; GW Pharmaceuticals plc Announces US Patent Allowance for Use of Cannabidivarin in Treating Epilepsy",0
DKS,2016-03-03,"Deutsche Bank Analyst Covering Dick's Earlier Commented on Sports Authority Bankruptcy: 'this could be a significant event for DKS'; Maintains Buy, $52 Target; Early Global News For Thursday: Groupon-IBM, Samsung SSD, Yahoo Deal Talk",1
NAV,2011-09-30,Navistar Announces Redemption Notice of Senior Notes   ; UPDATE: Benchmark Upgrades Marathon Oil to Hold,1
GD,2012-04-25,"Boeing Flies Above Defense Giants, Even On Defense - IBD; General Dynamics Reports Q1 EPS $1.57 vs $1.69 Est; Revenues $7.58B vs $7.91B Est; US Stock Futures Up After Upbeat Apple Results; Earnings Scheduled For April 25",0
JWN,2011-05-09,"Goldman Sachs Maintains Buy on Nordstrom (JWN); Retail Earnings: A Sneak Peek (KSS, JWN, WMT, TGT, HD)",1
AZN,2014-11-04,"AstraZeneca, Pharmacyclics And Janssen Partner On Immuno-Oncology Combination Trials With IMBRUVICA ; AstraZeneca Says Medimmune to Acquire Definiens for Initial Payment of $150M, Plus Milestone Payments",1
DKS,2017-07-12,Benzinga's Option Alert Recap From July 12; Dick's Option Alert: Dec 15 $34 Puts Sweep (15) at the Ask: 577 @ $2.3 vs 63 OI; Ref=$36.6,0
JWN,2016-09-30,Guggenheim Initiates Coverage On 21 Retail Stocks; Guggenheim Securities Initiates Coverage on Nordstrom at Buy,1
NAV,2015-09-04,MHR Fund Management Reports 19.9% Stake In Navistar International; Calls Of Note: The Research Moving Stocks On Friday,0
IMPV,2015-08-07,"Pacific Crest's Owens Lifts Target on Imperva from $67 to $80, Says 'Right Solutions, Right Market, Right Stock'; Wunderlich's Breza Raises Target on Imperva from $75 to $80, Says Co. 'executed above and beyond heightened expectations across all key metrics'",0
CHSP,2013-11-06,Chesapeake Lodging Trust Narrows FY2013 EPS Guidance from $1.74-1.80 to $1.74-1.77; Chesapeake Lodging Trust Sees Q4 EPS $0.40-0.43; Chesapeake Lodging Trust Reports Q3 FFO of $0.61 vs $0.35 Est; Revenue of $122.40M vs $125.0M Est,1
RST,2011-05-10,Morgan Stanley Reports 1Q Miss In EPS For RST; Jefferies Reiterates Its Hold On Rosetta Stone Following In-Line Earnings Report,2
FOX,2017-09-01,Big Ten Network's Big Tenth Anniversary: How A Conference Schooled Colleges In How To Cash In; WWE and Fox Sports Mexico Announce New Exclusive Weekly Programming; Watch These 5 Huge Put Purchases In Friday Trade,1
AZN,2015-06-09,"Benzinga's M&A Chatter for Tuesday June 9, 2015; Rumor Receptos Rejected $200/Share AstraZeneca Bid",1
HBAN,2010-12-16,"Huntington Bancshares Stephen Steinour: Q&A; Huntington Bancshares Closer to Repaying TARP by Year's End ; S&P Making Sharecount Changes, KBW Reports (HBAN, HCP, FHN, LXP)",1
RGLD,2012-08-09,Royal Gold Increases Gold Stream Interest in the Mt. Milligan Project to 52.25%; Royal Gold Reports Q4 EPS $0.34 vs $0.44 Est; Revenues $60.1M vs $69.26M Est,1
SNY,2010-10-08,"Sanofi Pasteur Awarded a $56.94M Contract; Another Job Cut Announced ; Stocks To Watch For October 8 (MU, GENZ, AA)",1
EGO,2017-07-31,15 Biggest Mid-Day Losers For Monday; Credit Suisse Downgrades Eldorado Gold Corporation Ordinary Shares to Underperform,2
SNY,2016-01-08,"Regeneron, Sanofi Announce FDA Has Accepted For Review BLA For Sarilumab; U.S. Stock Futures Surge After Jobs Data; El-Erian To Discuss Economic Situation; Regeneron, Sanofi Announce Sarilumab Biologics License Application Accepted for Review FDA",0
CLI,2014-07-24,Mack-Cali Realty Corporation Reports Q2 EPS of $0.50 vs $0.47 Est; Revenue of $160.30M vs $156.49M Est; Mack-Cali Realty Reports Q2 FFO of $0.50 vs $0.47 Est; Revenue of $160.30M vs $156.49M Est,1
RGS,2011-01-10,Regis' Second Quarter Sales Slip - Analyst Blog; Regis' Second Quarter Sales Slip - Analyst Blog,1
GWPH,2014-06-18,GW Pharmaceuticals Prices 1.7M ADS Offering at $86.83/ADS; GW Pharma To Raise $86 Million In Offering; Shares Down Off All-Time High; Morning Market Losers ; UPDATE: GW Pharma Shares Fall 4% Premarket on 1.7M ADS Offering Announcement; Benzinga's Top #PreMarket Losers,2
MDCO,2012-11-19,"Oppenheimer Initiates Coverage on Medicines at Outperform, Announces PT of $35; SAC Capital Discloses 5% Passive Stake in Medicines Co.",2
HMNY,2017-11-01,28 Stocks Moving In Wednesday's Pre-Market Session; 46 Biggest Movers From Yesterday,0
RGS,2011-07-08,Market Update; A Peek Into The Market Before The Trading Starts; Regis Reports 1.7% Decline In Q4 Same-Store Sales,2
AZN,2015-01-16,"Barclays Issues 3 Upgrades, 1 Downgrade On Pharma Stocks; Barclays Downgrades AstraZeneca to Underweight",1
DG,2015-10-21,Benzinga's Top Upgrades; Bank of America Upgrades Dollar General to Neutral,1
AGEN,2016-03-08,"UPDATE: Agenus Shares Spike to $4.13 on Form 4 Filing by CEO Showing 200K Share Buy; Chmn Armen Buys 200,000 Of Agenus @$4.03/Share -Form 4",1
TM,2015-03-04,"Fast Money Picks For March 4: Toyota, KB Home, CME Group; AutoNation Reports February 2015 Reported Retail New Vehicle Unit Sales Increased 8% vs February 2014",1
TXRH,2014-08-25,"S&P 500 Hits 2,000 Milestone As Bullish Momentum Continues; Stephens & Co. Upgrades Texas Roadhouse, Inc. to Overweight",1
SNY,2011-02-09,"Sanofi-Aventis Reports Q4 EPS of 1.41 EUR; US Stock Futures Signal Lower Start On Wall Street, Earnings In Focus",1
IMPV,2016-09-29,Benzinga's Top Downgrades; Buckingham Research Downgrades Imperva to Neutral,1
FISV,2013-02-05,"Fiserv, Inc. Reports Q4 EPS of $1.39 vs $1.42 Est; Revenue of $1.16B vs $1.18B Est; Fiserv Reports Q4 Adj EPS $.139 vs $1.40 Est",1
TAC,2016-11-25,12 Biggest Mid-Day Gainers For Friday; Mid-Day Market Update: Crude Oil Down 3.5%; Navidea Shares Spike Higher; Mid-Morning Market Update: Markets Open Higher; Ctrip.Com To Acquire Skyscanner,2
JCI,2010-12-10,Johnson Acquires German Seat Maker - Analyst Blog; Johnson Acquires German Seat Maker - Analyst Blog; Wunderlich Raises PT On Johnson Controls,1
AZN,2014-09-02,SunTrust Sees Further Pfizer Inc. Bid For AstraZeneca PLC (ADR) 'Highly Likely'; AstraZeneca CEO Says Back to Normal Despite Pfizer Rumors -Reuters,1
ELGX,2015-10-26,"Endologix, Inc. and TriVascular Technologies, Inc. Announce Merger to Create a Leading Cardiovascular Growth Company Focused on the Treatment of Aortic Disorders, $9.10/TriVascular Unit, Total $211M; Endologix Reports Q3 Adj. EPS $(0.13) vs. Est. $(0.14), Rev. $38.231M vs. Est. $38.12M",1
NPO,2015-02-19,"J. Milton Childress to Assume EnPro CFO Role as of  March 31, 2015, Replacing Alexander W. Pease; Enpro Industries Reports Q4 EPS $0.57 vs $0.40 Est., Sales $316.4M vs $300M Est.; Announces $80M Buyback Plan",1
AZN,2014-06-03,AstraZeneca Announces Enlarged Recruitment For Tremelimumab Phase II; AstraZeneca Announces Announces Positive AZD9291 Trial Results,1
PRGS,2013-09-25,"Progress Software Expecting Q4 Sales Growth 4-6%, Oper. Margin 35%; Progress Software Corporation Reports Q3 EPS of $0.27 vs $0.24 Est; Revenue of $77.60M vs $76.70M Est; Earnings Scheduled For September 25, 2013",1
CASH,2017-10-30,Meta Financial Reports Q4 Sales $54.3M vs $39.1M In Same Qtr. Last Year; Meta Financial Group Reports Q4 GAAP EPS $0.19 vs $0.70 In Same Qtr. Last Year,0
SNY,2012-07-20,"Financial Breakfast: Morning News Summary for July 20, 2012; Sanofi and Regeneron Launch Comprehensive Phase 3 Clinical Program With LDL Cholesterol-Lowering PCSK9 Antibody ",1
STLD,2017-01-18,"Option Alert: Steel Dynamics Feb 38.0 Calls Sweep: 501 @  ASK  $1.299: 1552 traded vs 6747 OI:  Earnings 1/24 After Close  $37.23 Ref; Steel Expert: Wilbur Ross Comments Give Investors Unfounded Hope; Axiom's Gordon Johnson Says Positive Market Reaction To U.S. Steel Names 'Misplaced', Following Wilbur Ross Comments On Steel Industry Overcapacity; Axiom's Gordon Johnson, In Response To Wilbur Ross Comments On Steel Industry, Tells Benzinga More Restrictions On Steel Mean Very Little Given the Many Restrictions On China Already; Trump U.S. Commerce Secretary Nominee Ross Says Steel Industry Problem Due To Overcapacity, Particularly In China; Believes Tariffs May Be Required To Stop Steel And Aluminum Dumping",2
TOL,2011-08-23,"Notable Call Options Activity in Toll Brothers; Option Alert: Heavy Volume in Toll Brothers September 15 Call; 13,860 Contracts",1
NRP,2011-01-11,Natural Resource Partners (NRP) - Bull of the Day; Natural Resource Partners (NRP) - Bull of the Day,1
HALO,2015-07-31,"Eisai, Halozyme Agree To Collaboration On Eribulin & PEGPH20 Metastic Breast Cancer Investigation; US Stock Futures Edge Lower Ahead Of Consumer Sentiment Report; Eisai, Halozyme Anounce Collaboration to Investigate Eribulin and Pegph20 in Advanced Breast Cancer",1
DKS,2016-05-23,"Worst Performing Industries For May 23, 2016; Brean Still Buying Foot Locker, Lowers Price Target To $66",0
NKTR,2012-03-26,UPDATE: Hearing Nektar Therapeutics to Receive Royalties if MAP Pharmaceuticals Drug is Approved; Chatter is Drug Won't be Approved; Hearing Nektar Therapeutics to Receive Royalties if MAP Pharmaceuticals Drug is Approved,2
MDCO,2017-04-26,"UPDATE: The Medicines Co., Alnylam Says NDA Submission for Inclisiran Expected At or Around End of '19; UPDATE: The Medicines Co., Alnylam Said Primary Endpoint for All of Inclisiran's Pivotal Trials Will be LDL-C Change from Baseline; The Medicines Co., Alnylam Earlier Announced Deal with FDA on Phase III Trial for Inclisiran; The Medicines Company Q1 EPS $(1.05) vs $(1.24) Est, Sales $24.2M vs $34.1M Est",0
NRG,2013-10-18,NRG Energy Resumes Trading; NRG Energy to Acquire Edison Mission Energy for Aggregate Purchase Price of $2.635B; NRG Files $350M Common Stock Shelf ; NRG Energy Halted; Pending News,2
GABC,2011-04-28,CORRECTION: German American Bancorp Reports EPS of $0.35 vs. $0.23; German American Bancorp Reports EPS of $0.35 vs. $0.29,1
SNY,2017-04-20,"Financial Times Reporting Sanofi Epilepsy Drug Caused Birth Defects In Children; Hearing Sanofi's Head of Diabetes Unit Has Said Co. is Considering Diabetes Device Assets Which May Come to Market, is Not Positive a Any Deal Will Happen",1
MDCO,2016-01-19,Medicines Company Shares Make Odd Mid-Day Spike; Is The Company A Takeover Target?; The Medicines Co. Shares Spiking Higher Off Session Low Over Last Few Mins; Stock Now Up ~$0.80 Over Last Four Mins,0
CSV,2014-08-05,"Carriage Services, Inc. Reports Q2 EPS of $0.32 vs $0.29 Est; Revenue of $56.50M vs $56.58M Est; Carriage Services Reports Q2 Adj. EPS $0.32 vs $0.29 Est., Sales $56.5M vs $56.4M Est.",1
EFX,2017-09-07,UPDATE: Equifax Says Credit Card Numbers For ~209K US Consumers With Personal Identifying Info Was Accessed; Equifax Reports Cybersecurity Incident Related To Consumer Info: 'No Evidence of Unauthorized Access to Core Consumer or Commercial Credit Reporting Databases',1
GD,2017-07-26,"General Dynamics Raises FY17 EPS Outlook From $9.50-$9.55 To $9.70-$9.75 vs $9.81 Est.; General Dynamics Reports Q2 EPS $2.45 vs $2.43 Est., Sales $7.7B vs $7.75B Est.; Earnings Scheduled For July 26, 2017",0
FOXF,2015-11-04,"Fox Factory Sees FY15 Adj. EPS $0.97-$1.01 vs $0.95 Est., Sales $358M-$364M vs $354M Est.; Fox Factory Sees Q4 Adj. EPS $0.21-$0.25 vs $0.22 Est., Sales $87M-$93M vs $86M Est.; Fox Factory Reports Q3 Adj. EPS $0.38 vs $0.36 Est., Sales $106.2M vs $105M Est.",0
LEDS,2011-01-13,"Wave Systems, Biodel: Small-Cap Winners; Cree Falling On Heavy Volume (CREE); SemiLEDs Results Weigh on LED Stocks",1
AEZS,2017-04-28,Aeterna Zentaris Will Announce Top-Line Results Of ZoptEC Phase 3 Study May 1 Before Market Open; Aeterna Zentaris Announces Replacement at the Market Issuance Program with H.C. Wainwright,2
SNY,2013-11-18,2013 3Q 13F Roundup; Kepler Upgrades Sanofi to Buy,1
PERY,2014-08-22,"Benzinga's Top Downgrades; KeyBanc Downgrades Perry Ellis To Hold; KeyBanc Downgrades Perry Ellis International Inc. to Hold, Removes $20.00 PT",1
JWN,2010-08-12,"Nordstrom Reports Second Quarter 2010 Earnings; Nordstrom Earnings Largely In-Line (JWN); Nordstrom Reports Second Quarter Earnings (JWN); Stocks To Watch For August 12 (NVDA, CSCO, JWN, KSS); Earnings Scheduled For August 12 (JWN, NVDA, SLE, KSS, RDEN, EL)",2
MBUU,2014-02-25,"Raymond James Initiates Coverage on Malibu Boats at Strong Buy, Announces $21.00 PT; SunTrust Robinson Humphrey Initiates Coverage on Malibu Boats at Buy, Announces $23.00 PT; Wells Fargo Initiates Coverage on Malibu Boats at Outperform; BMO Capital Initiates Coverage on Malibu Boats at Outperform, Announces $22.00 PT",1
GD,2012-04-03,Why cash flow is king in our portfolio; General Dynamics Awarded $25 Million for Submarine and Carrier Maintenance Work ,1
FOXF,2017-07-12,"Benzinga's Top Upgrades, Downgrades For July 12, 2017; Bank of America Downgrades Fox Factory Holding to Neutral",1
