stock,date,title,label
FENG,2013-11-14,"UPDATE: J.P. Morgan Reiterates on Phoenix New Media as 3Q Online Ads are Strong, Mobile Ad Monetization Gains Traction; JP Morgan Maintains Overweight on Phoenix New Media Limited, Raises PT to $15.00",0
TM,2017-06-06,"Perspective: Last Week's Auto Sales Figures Aren't Concerning, They're Returning To Normal; BlackBerry Shares Down 1.2% Premarket Amid Word Toyota Has Said Will No Longer Use Co.'s QNX Software for Its Vehicle's Consoles",1
DKS,2012-02-13,"Four Stocks for an Early Spring: Dicks, Energizer, Lowe's, Toro; Dicks Sporting Goods Hits 52-Week High of $44.53",1
CPST,2015-05-20,Capstone Recieves C1000 MIcroturbine Order; Capstone Expands Presence in European Renewable Energy Market with Biogas-fueled Microturbines,1
RENN,2011-06-13,"Top Percentage Gainers and Losers as of 12pm 06/13/11; China Merchants Bank and Renren to Pioneer Social Credit Card; Oppenheimer Initiates Renren At Outperform, $12 PT",0
AVY,2017-07-25,"Avery Dennison Raises Guidance, Sees FY 2017 EPS $4.75-$4.90 from $4.50-$4.65 vs $4.60 Est.; Avery Dennision Q2 EPS $1.31 vs $1.21 Est., Sales $1.63B vs $1.61B Est.; Earnings Scheduled For July 25, 2017",0
AZN,2017-05-12,"15 Biggest Mid-Day Gainers For Friday; AstraZeneca Sharply Higher Off Positive Data For Imfinzi; 22 Stocks Moving In Friday's Pre-Market Session; AstraZeneca +5.73% Premarket @$32.82, Co Announced Imfinzi Met Primary Endpoint NSCLC",2
GWPH,2014-02-07,"Piper Sees ""Meaningful Utility"" from GW Phamaceuticals CBD, Reiterates Overweight Rating; GW Pharma Shares Getting a Pop as Piper Jaffray Boosts Target from $77 to $97",2
GWPH,2017-08-08,"Is GW Pharma Now The Future Of Cannabis-Based Drugs?; Benzinga's Top Upgrades, Downgrades For August 8, 2017; Maxim Group Downgrades GW Pharmaceuticals Plc - American Depositary Shares to Hold",0
GWPH,2017-10-12,How This Leading Marijuana Company Is Capitalizing On The Rise Of Smoke-Free Weed Consumption; Three Ways To Approach The Cannabis Trade,1
AGEN,2013-06-18,"Maxim Group Initiates Coverage on Agenus Inc. at Buy, Announces $19.00 PT; Agenus Spike Higher",1
HOS,2011-09-23,"Global Hunter Securities Upgrading Hornbeck Offshore Services; Global Hunter Securities Upgrading Gulfmark Offshore ; Global Hunter Upgrades GLF, HOS, NE, OII, RDC",0
GGP,2011-01-25,General Growth Properties Announces Results of Dividend Elections; General Growth Announces Dividend Results (GGP),2
ZGNX,2014-03-14,"Morning Losers for Friday, March 14, 2014; Benzinga's Top #PreMarket Losers",2
CNX,2013-07-25,"Short Interest in Peabody Energy Rises, in Rhino Resource Partners Falls (BTU, CLD, RNO); CONSOL Energy Inc. Reports Q2 EPS of $(0.03) vs $0.17 Est; Revenue of $1.22B vs $1.21B Est",2
ELGX,2017-03-24,Benzinga's Option Alert Recap From March 24; Option Alert: Endologix May 7.5 Calls: 1000 @  ASK  $0.65: 1122 traded vs 1261 OI:  Earnings 5/9 After Close (est)  $6.79 Ref,2
TM,2010-10-21,"Zings Of The Day (FNM, TM); Toyota to Recall More U.S., Japanese Cars",1
STLD,2012-12-18,"UPDATE: Bank of America Raises PO to $14 on Steel Dynamics on Guidance   ; Bank of America Maintains Neutral on Steel Dynamics, Inc., Raises PO to $14.00",2
RLJ,2013-06-26,"UPDATE: BMO Capital Markets Initiates RLJ Lodging Trust at Market Perform on Mixed Factors; BMO Capital Initiates Coverage on RLJ Lodging Trust at Market Perform, Announces $23.00 PT",2
COF,2011-04-21,"UPDATE: Capital One Reports Q1 EPS $2.24 vs. $1.55; Revenues $4.08B vs. $3.88B Est. (COF); Earnings Scheduled For April 21 (AMD, MCD, GE, AEP, NYT, JBLU, SLB, COF, DD, VZ, LUV, PM, MS, UNH, RAI, NOK, UAL)",2
GWPH,2016-04-21,"GW Pharmaceuticals Gets Orphan Drug Status For Cannabidiol, Stock Rises; GW Pharmaceuticals Receives Orphan Drug Designation from FDA for Cannabidiol for Treatment of Tuberous Sclerosis Complex",0
TM,2014-04-09,Market Wrap For April 9: Investors Breathe Sigh Of Relief Over Rate Worries; Toyota Recalls 6.4M Vehicles Worldwide Over Vehicle Defects,1
PRGS,2012-10-09,"Mizuho Securities Downgraded Progress Software from Neutral to Underperform; Benzinga's Top Downgrades; Jefferies & Company Maintains Progress Software at Hold, Lowers PT from $23 to $21",0
LEDS,2017-01-12,"12 Biggest Mid-Day Gainers For Thursday; 20 Stocks Moving In Thursday's Pre-Market Session; SemiLEDs Reports Q1 EPS $(0.94), Rev. $2.7M",0
FOXF,2016-05-04,"Fox Factory Reaffirms FY16 Sales $375M-$395M vs $388.6M Est., Adj. EPS $1.05-$1.13 vs $1.10 Est.; Fox Factory Sees Q2 Sales $95M-$101M vs $101.6M Est., Adj. EPS $0.25-$0.30 vs $0.29 Est.; Fox Factory Reports Q1 Adj. EPS $0.16 vs $0.14 Est., Sales $80.2M vs $74.5M Est.",1
CNX,2014-06-12,"Market Wrap For June 12: Iraq Concerns Dampens Bullish Momentum; CORRECTION: CONSOL Energy To Form MLP With Noble Energy; IPO To Come; CONSOL Energy To Form MLP With Noble Energy; IPO To Come; CONSOL Energy, Noble Energy to Form Marcellus Midstream MLP, Will IPO",0
MTOR,2016-08-03,"Meritor Sees FY16 Rev. ~$3.225B, Down From $3.275B, Adj. EPS ~$1.60 vs. Range Of $1.55-$1.65; Meritor Reports Q3 Adj. EPS $0.57 vs. Est. $0.43, Rev. $841M vs. Est. $838M",2
NRG,2010-11-26,NRG Energy Lowers Guidance - Analyst Blog; NRG Energy Lowers Guidance - Analyst Blog,1
DKS,2017-07-11,DICK'S Names Scott Hudler Chief Marketing Officer; Watch These 5 Huge Call Purchases Tuesday,1
ETN,2017-03-22,Benzinga's Option Alert Recap From March 22; Option Alert: Eaton May 75.0 Calls Sweep: 2153 @  ASK  $1.30: 3947 traded vs 64 OI:  Earnings 4/27 Before Open (est)  $72.23 Ref,1
NBL,2017-05-01,"Noble Energy Q1 EPS $(0.05) vs $(0.14) Est, Sales $1.04B vs $959.0M Est; Earnings Scheduled For May 1, 2017",1
ETN,2013-09-09,"UPDATE: Morgan Stanley Upgrades Eaton Corporation on Critical Catalyst; Benzinga's Top Upgrades; Morgan Stanley Upgrades Eaton Corporation to Overweight, Raises PT to $76.00",1
GD,2011-06-14,"The Appropriations Committee has Approved the $649B Defense Bill, $9B Cut; General Dynamics to Acquire Fortress Technologies; Terms Not Disclosed ",1
AVY,2017-01-06,"Benzinga's Top Upgrades, Downgrades For January 6, 2017; Citigroup Upgrades Avery Dennison to Buy",1
ETN,2010-12-29,Triumph Continues Triumphant - Analyst Blog; Triumph Continues Triumphant - Analyst Blog,1
TOL,2017-01-06,"Benzinga's Top Upgrades, Downgrades For January 6, 2017; Barclays Initiates Coverage On Toll Brothers at Equal-Weight, Announces $32.00 Target",0
COF,2014-04-16,"Capital One Financial Corporation Reports Q1 EPS of $1.96 vs $1.67 Est; Revenue of $5.37B vs $5.45B Est; Earnings Scheduled For April 16, 2014",1
GD,2012-07-25,"General Dynamics Guides FY to $7-7.10, Had Seen $7.10-7.20; Financial Breakfast: Morning News Summary for July 25, 2012; General Dynamics Reports Q2 EPS $1.77 vs $1.74 Est; Revenues $7.92B vs $7.93B Est; Earnings Scheduled For July 25",0
RGS,2011-08-16,"Regis Issues Statement in Response to Starboard Letter to Company   ; Starboard Asks Regis to Cut Operating Costs, Exit Non-Core Business; Nominates 3 to Regis Board; Says it Holds 4.4% of Regis",2
SNY,2017-01-06,"Low Odds Court Ruling Against Regeneron Get Reversed On Appeal; Amgen Higher After Favorable Court Ruling; 5 Key Takeaways In Regeneron's Praluent Suit, Steps Forward; Regeneron Falls As Court Grants Permanent Injunction For Infringement Of Amgen's Repatha Patents; UPDATE: Court Grants Permanent Injunction for Infringement of Amgen's Repatha Patents",1
CPST,2010-02-10,"Capstone Turbine Corporation (CPST) Shares Jump 11%; Benzinga’s Top Upgrades (CPST, BWY, VE, ETR, CBSH)",2
PTR,2011-08-10,"Benzinga's Top ETF Decliners, August 10th (RUSL, FAS, URTY, EDC); Benzinga's Top ETF Gainers, August 10th (TVIX, FAZ, FSG, EDZ)",1
SNY,2014-09-25,NASDAQ Dips 1.5%; HB Fuller Shares Decline On Downbeat Results; Markets Tumble; Scholastic Posts Wider Fiscal-First Quarter Loss; Morning Market Movers ,1
ONP,2014-11-03,"Orient Paper Appoints Jing Hao As CFO; Orient Paper, Inc. Reports Q3 EPS of $0.18; Revenue of $40.80M",0
EROS,2017-07-28,"20 Biggest Mid-Day Losers For Friday; Eros Int'l Shares Resume Trade, Bounce Off Session Lows; Stock Down 24% For Session; Eros Int'l Shares Halted On Circuit Breaker, Down 33%; Eros Int'l Reports Q4 EPS $(0.044), Sales $52.675M",0
AEZS,2017-01-31,15 Biggest Mid-Day Gainers For Tuesday; Mid-Day Market Update: Dow Falls Over 100 Points; DryShips Shares Spike Higher; Mid-Morning Market Update: Markets Open Lower; Mastercard Earnings Beat Views; 22 Stocks Moving In Tuesday's Pre-Market Session,2
COF,2012-03-15,"UPDATE: Jefferies Raises Target on Capital One to $50; Capital One Announces Pricing 24.44M Shares of Common Stock Offering at $51.65/Share; Jefferies & Company Maintains Capital One Financial at Hold, Raises PT from $40 to $50; Jefferies & Company Maintains Capital One Financial at Hold, Raises PT from $40 to $50",2
ENVA,2016-04-28,"Enova Sees FY16 Sales $680M-$730M vs $700.4M Est., Adj. EBITDA $125M-$140M; Enova Sees Q2 Sales $155M-$177M vs $161.8M Est., Adj. EBITDA $23M-$33M; Enova Reports Q1 EPS $0.30 vs $0.21 Est., Sales $174.7M vs $165.3M Est.",2
NAV,2011-10-21,"Ford Motor Company Earnings Preview: Analysts Expect Rising Revenue, Falling EPS; Icahn Wants Navistar International to consider Merger with Oshkosh -Reuters ",2
ADI,2011-05-31,Sterne Agee Reiterates Buy Rating On Analog Devices; Bank of America Merrill Lynch Reinstating Coverage On Analog Devices Inc.,1
ALSN,2017-11-08,Allison Transmission Increases Buyback by $500M; Allison Transmission Adds $500M To Buyback Plan,1
DG,2012-05-31,"5 Top-Rated Retail Stocks Bucking Market Correction - IBD; UPDATE: Guggenheim Raises Dollar General's PT ; Guggenheim Maintains Dollar General at Buy, Raises PT from $54 to $57",1
RGEN,2013-05-02,Repligen Corporation Sees FY2013 Sales $63.0M-65.0M vs $56.90M Est; Repligen Corporation Reports Q1 EPS of $0.07 vs $0.11 Est; Revenue of $16.50M,1
JWN,2012-11-09,"UBS Maintains Nordstrom at Buy, Raises PT from $63 to $67; Deutsche Bank Maintains Nordstrom at Buy, Lowers PT from $62 to $61; US Stock Futures Flat Ahead Of Economic Data; Stocks To Watch For November 9, 2012",1
KEY,2013-01-31,Sanford Bernstein Downgrades KeyCorp to Underperform; Few trade ideas for the last day of January; Benzinga's Top Downgrades,1
BIOA,2014-07-16,Morning Market Losers ; BioAmber Prices 2.8M Share Offering at $12/Share,1
COF,2011-08-11,Citi Reports On COF's Recent Acquisition; Bank of America Merrill Lynch Has Buy On Capital One ,2
MDCO,2016-01-11,The Medicines Compnay Initiates Sites ANd Begins Enrolling Patients In Dose-Finding Phase 2 Study For PCSK9 Synthesis Inhibitor For ASCVD; aTyr Reports Update For 2016 Company Outlook,1
DKS,2012-03-05,"UPDATE: Goldman Sachs Raises PT to $49 on Dick's Sporting Goods; Goldman Sachs Maintains Dicks Sporting Goods at Buy, Raises PT from $48 to $49; Bank of America: Continued Strength in Athletic Footwear Supports Dick's Margin Outlook",1
TM,2013-10-28,"Toyota Top in Auto Sales, Faces Fallout after Jury Ruling; Consumer Reports Will No Longer Recommend Status from Toyota Camry; Report Shows Top Five Reliable Brands Include Mazda, Audi, Acura, Tesla's Model S Receives Recommended Status; BMW CEO Says Supports Germany's 1M Electric Car Goal, Calls for Balanced, Sustainable European Approach",1
NAV,2014-03-25,"Benzinga's Top Downgrades; UBS Downgrades Navistar International Corporation to Neutral, Lowers PT to $36.00; US Stock Futures Rise Ahead Of Housing Data",0
MTOR,2017-02-01,"Meritor Sees FY17 Adj. EPS $1.25-$1.40 vs $1.62 Est., Sales $3B-$3.1B vs $3.26B Est.; Meritor Reports Q1 Adj. EPS $0.25 vs $0.19 Est., Sales $699M vs $723M Est.",2
DG,2014-08-14,"13F Filing from Paulson & Co. Shows New Stakes in Covidien, DirecTV, Allergan, Questcor, Liquidated Stakes in Hess Corp. GM, Capital One, Raised Stakes in Family Dollar, Dollar General, Lowered Stakes in Freeport-McMoRan, CBS; 13F from Lone Pine Shows Reduced Stakes in Dollar General, Microsoft, 21st Century Fox, New Stakes in Canadian Pacific, Under Armour, Comcast; 13F from Leon Cooperman's Omega Recently Filed: Showed New Stake in Apple, Liquidated Stakes in SunPower, Dollar General, Raised Stakes in Actavis, SUPERVALU, Reduced Stakes in Capital One, Qualcomm, Sprint",1
TAC,2015-12-29,8 Stocks Moving In Tuesday's After-Hours Session; Mid-Afternoon Market Update: Dow Jumps 200 Points; Anavex Life Sciences Shares Slide After Subpoena Disclosure; Mid-Morning Market Update: Markets Open Higher; Icahn Enterprises Increases Bid For Pep Boys,0
ZGNX,2011-11-11,UPDATE: Oppenheimer Lowers PT to $4 on Zogenix ; Oppenheimer Lowers PT on Zogenix to $4,0
GD,2016-10-28,General Dynamics To Rebound Soon: Vetr; Vertical Research Initiates Coverage On General Dynamics Corporation Common Stock at Buy,1
HOS,2013-11-01,"UPDATE: Wunderlich Securities Downgrades Hornbeck Offshore Services on Less Aggressive Dayrate Progression; Wunderlich Downgrades Hornbeck Offshore Services to Hold, Lowers PT to $61.00",1
HALO,2016-03-01,Mid-Morning Market Update: Markets Open Higher; Dollar Tree Misses Q4 Views; 10 Stocks Moving In Tuesday's Pre-Market Session,1
PAG,2017-04-26,"Penske Automotive Q1 EPS $0.97 vs $0.96 Est, Sales $5.1B vs $4.9B Est; Earnings Scheduled For April 26, 2017",0
GWPH,2014-12-02,"GW Pharmaceuticals Conference Call Highlights; GW Pharma Reports FY14 Sales $48.7M vs $44.3M During 2013, After-Tax Net Loss$23.8M vs $7.4M in '13; Earning and Economic Calendar for Tuesday December 2, 2014; Earnings Scheduled For December 2, 2014",0
DG,2012-04-09,"UPDATE: Deutsche Bank Raises Dollar General's PT; Deutsche Bank Maintains Dollar General at Buy, Raises PT from $49 to $52",1
DG,2013-08-26,"13G Filing from Lone Pine Capital Shows Raised Stake in Dollar General to 5.4% Stake, Had Shown 4.17% Stake as of Jun. 30th; Deutsche Bank Maintains Buy on Dollar General Corporation, Raises PT to $62.00",1
KANG,2014-06-09,iKang Healthcare Group Sees FY2015 Sales $282.0M-290.0M vs $281.90M Est; iKang Healthcare GroUp Reports Q4 GAAP EPS of $(1.24) Which May Not Compare $(0.11) Est; Revenue of $29.50M Which May Not Compare $23.37M Est,1
NM,2011-04-20,Outlook of Shipping Stocks; Outlook of Shipping Stocks; Outlook of Shipping Stocks; Outlook of Shipping Stocks,1
TM,2015-02-03,Will HERO Camera Demand Aid GoPro Earnings?; Toyota Reports Jan. Auto Sales Growth 15.6%; 25 Stocks To Watch After Super Bowl Sunday,1
GLMD,2015-01-13,13G: Allen Baharaff Reports 34.9% Stake In Galmed Pharmaceuticals; 13G:  Chaim Hurvitz Reports 9% Stake In Galmed Pharma.,2
RLJ,2014-11-12,"Credit Suisse Initiates Coverage On 34 REITs, Names Top Picks; Credit Suisse Initiates Coverage on RLJ Lodging Trust at Outperform, Announces $35.00 PT",1
COF,2011-10-20,Capital One Financial Reports 4.6% Rise in Revenues; Profit Up for Capital One Financial; Capital One Financial Reports Q3 EPS $1.77 vs $1.68 Est,1
NRG,2011-05-06,"Jefferies Raises PT On NRG Energy To $26, Maintains Hold (NRG); Jefferies Raises PT On NEG Energy To $26",1
G,2014-02-06,"Genpact Limited Sees FY2014 Sales $2.22B-2.26B vs $2.35B Est; Genpact Limited Reports Q4 EPS of $0.25, Inline; Earnings Scheduled For February 6, 2014",1
CNX,2015-04-28,"Consol Energy Q1 Rev $889.6M vs $896.7M est; Consol Energy Q1 EPS $0.37 vs $0.13 est, May Not Compare",0
TOL,2012-03-23,Notable Put Options Activity in Toll Brothers; Housing Stocks Fall On Home Sales Data; Home Builder Stocks Spike Lower on Disappointing New Home Data,2
WAT,2011-10-07,"End-of-Day Market Summary for October 7, 2011; Afternoon Losers; Sprint Down 15%",0
MNTX,2011-09-12,Manitex International Announces $3.1 Million in New Orders ; Manitex International Announces $3.1 Million in New Orders,1
ACGL,2012-10-15,"Stocks Hitting 52-Week Highs; Deutsche Bank Maintains Arch Capital Group at Hold, Raises PT from $41 to $44",1
RUTH,2016-02-12,"Ruth's Raises Qtr. Dividend from $0.06 to $0.07/Share; Ruth's Reports Q4 Adj. EPS $0.26 vs $0.25 Est., Sales $104.7M vs $106.3M Est.; Earnings Scheduled For February 12, 2016",1
NAV,2012-03-22,Owl Creek Cuts Stake in Navistar to 4.4%; Sterne Agee: Navistar in Position to Represent 20% of Industry Sales,1
JWN,2016-01-05,"Option Alert: JWN Jan16 47.65 Puts: 8467 @  Above Ask!  $0.45: 8867 traded vs 974 OI:  Earnings 2/18  $50.02 Ref; Buckingham Cuts Targets On Dillards, Gap, Nordstrom, Macy's, Raises Target On Kohl's; Benzinga's Top Downgrades; Citigroup Downgrades Nordstrom to Neutral, Lowers PT to $52.00",1
STLD,2011-07-18,"Steel Dynamics Beats On Top And Bottom Lines; Steel Dynamics Reports Q2 EPS of $0.43 vs. $0.39 Est; Revenues $2.1B vs. $2.01B Est		; REMINDER: Notable Companies Reporting After the Close Including IBM, MOS, PKG, SWK, STLD, WYNN; Earnings Preview: Steel Dynamics; News Summary for July 18, 2011",0
FISV,2011-11-01,Fiserv Sees 2011 EPS $4.54-$4.60 vs $4.48 Est (Saw $4.42-$4.54); Fiserv Reports Q3 EPS $1.16 vs $1.14 Est; Revenues $1.06B vs $1.06B Est				,1
FOXF,2016-08-09,There Have Been 20 Secondary Offerings Over The Last 2 Days; 20 Biggest Mid-Day Losers For Tuesday; 22 Stocks Moving In Tuesday's Pre-Market Session,1
RENN,2011-11-28,Beware Of Weak Stocks In A Strong Market; Renren Hits 52-Week Low of $3.59,0
LEDS,2011-04-06,Lazard Comments On SemiLEDs Following Recent Earnings Report; Jefferies Lowers LEDS PT To $15; Jefferies Lowers PT On SemiLEDs To $15,1
ADI,2016-05-18,"3 Best Ways To Invest In Driverless Car Technology Today; Analog Devices Reports Q2 Adj. EPS $0.64 vs $0.62 Est., Sales $778.8M vs $777.6M Est.; Earnings Scheduled For May 18, 2016",2
PAG,2016-08-09,3 Transportation CEOs Make Big Bets On Their Companies; Seaport Global Initiates Coverage on Penske Automotive Group at Neutral,1
JWN,2017-10-16,"4 Stocks Reeling On Retail News; The Nordstrom Family Says it Will Explore the Possibility of a Go Private Transaction Again After the Holiday Season; Bruce Nordstrom Says the Company Has Suspended Proposing a Go Private Transaction Through the End of the Year, Reaffirms 31.3% Stake in 13D Filing; Shares of Macy's and Nordstrom Falling on Volume",1
DKS,2014-09-16,"Arch Coal Inc, Dicks Sporting Goods Inc Highlight CNBC's Stock Pops & Drops From September 16; Dick's Sporting Goods President and COO Joseph Schmidt to Retire, Will Remain at Co Till End of FY 2014 ",1
DG,2014-12-01,"UPDATE: Credit Suisse Reiterates On Dollar General On Fundamental Opportunity; Credit Suisse Maintains Outperform on Dollar General Corporation, Raises PT to $76.00",1
EGO,2014-02-24,TD Securities Downgrades Eldorado Gold Corporation to Buy; Mackie Research Downgrades Eldorado Gold Corporation to Hold,0
TRK,2016-07-27,"Speedway Motorsports Sees FY 2016 EPS $0.90 to $1.10 vs $1.08 est; Speedway Motorsports Q2 EPS $0.60 vs $0.71 est, Revenue $175.7M vs $180.2M est",2
CDXS,2012-02-21,"UPDATE: Piper Jaffray Downgrades Codexis; Lowers PT; Benzinga's Top Downgrades; Financial Breakfast: Morning News Summary for February 21, 2012; Piper Jaffray Downgrades Codexis from Neutral to Underweight, Lowers PT from $5 to $3.5",0
COF,2012-03-21,"UPDATE: Guggenheim Upgrades Capital One and Regions Financial; Raises PT's; Morgan Stanley Maintains Capital One Financial at Overweight, Raises PT from $59 to $67; Morgan Stanley Maintains Capital One Financial at Overweight, Raises PT from $59 to $67; Guggenheim Upgrades Capital One Financial from Neutral to Buy, Raises PT from $54 to $67",1
SNY,2015-11-09,Bryan Garnier Downgraded Sanofi to Neutral; UBS Downgrades Sanofi to Neutral; Bernstein Downgrades Sanofi to Market Perform,1
GGP,2014-04-29,"From General Growth Properties Call: Expecting 4-4.5% Same-Store NOI Growth, 11% FFO Growth; Stifel Nicolaus Maintains Buy on General Growth Properties, Inc., Raises PT to $25.00",1
KANG,2016-01-06,"Expanded Meinian Consortium Improves iKang Proposal To $25/ADS, Improved Offer Is 40.4% Premium To Mr. Zhang Ligang's Buyer Group Dated 8/31/2015; Benzinga's Volume Movers; Benzinga's Top #PreMarket Gainers",0
BPI,2013-07-10,"UPDATE: Bridgepoint Education Highlights Accreditation Approval by WASC, Offers Q2 Outlook; Bridgepoint Education Issues Release Applauding Ashford University on Accreditation by WASC, Says Sees Q2 EPS $0.16-0.20 vs $0.34 Est. on Sales $195.5M-199.5M vs $205.2M Est.; Bridgepoint Education Issues Release Applauding Ashford University on Accreditation by WASC, Says Sees Q2 EPS $0.16-0.20 vs $0.34 Est. on Sales $195.5M-199.5M vs $205.2M Est.",2
DKS,2014-12-10,"Highlights From Bank Of America's Roosevelt Field Holiday Mall Tour; Nike, Dicks Sporting Goods Top Picks At Bank Of America",1
GD,2013-09-04,Drone Technology In Everyday Applications: Not Just For The Military Anymore; Top 4 Large-Cap Stocks In The Aerospace/Defense Products & Services Industry With The Lowest PEG Ratio,1
EFX,2017-09-18,Cramer: Don't Get Overly Comfortable As Markets Continue Hitting New Highs; The Latest On Equifax: Things Aren't Getting Any Better; Equifax Shares Unaffected Following Earlier Intraday Headline Suggesting Dept. Of Justice Is Probing Co. Related To Insider Sales,1
DOC,2016-12-16,Jefferies Initiates Coverage On Physicians Realty Trust at Hold; KeyBanc Downgrades Physicians Realty Trust to Sector Weight,1
NKTR,2017-11-09,"Benzinga's Top Upgrades, Downgrades For November 9, 2017; Canaccord Genuity Initiates Coverage On Nektar Therapeutics with Buy Rating, Announces $35.00 Price Target; 57 Biggest Movers From Yesterday",2
DG,2012-06-21,"UPDATE: Bank of America Merrill Lynch Raises PT on Dollar General to $60; Coca-Cola FEMSA, Family Dollar, Other Dividend Payers on a Roll; Bank of America Maintains Dollar General at Buy, Raises PO from $56 to $60",1
KEY,2013-01-24,"UPDATE: KeyCorp Q4 Profit Rises 1.5%; KeyCorp Reports Q4 EPS of $0.21, Inline; US Stock Futures Mixed After Disappointing Apple Results; Earnings Scheduled For January 24, 2013; Stocks To Watch For January 24, 2013",2
TX,2012-08-03,UPDATE: Goldman Sachs Downgrades Ternium from Buy to Hold; Goldman Sachs Downgrades Ternium SA from Buy to Neutral,0
ZGNX,2016-11-07,"Zogenix Reports Q3 Loss/Share $0.69 vs $0.96 Est Loss/Share, Revenue $6.6M vs $3.1M Est; Zogenix Reports Q3 EPS $(0.69) vs $(0.96) Est., Sales $6.6M vs $3.1M Est.",2
WNS,2011-01-20,J.P. Morgan Maintains Underweight on WNS Holdings (WNS); JP Morgan Lowers PT On WNS Holdings,1
TCS,2017-02-07,"The Container Store Cuts FY16 Guidance To EPS $0.20-$0.30 vs $0.26 Est, Sales Of $820M-$830M vs $823.14M Est; The Container Store Comps Down 3.9% In Q3; The Container Store Group Reports Q3 $0.11 In-line, Sales $216.4M sv $218.97M Est",0
BPI,2011-03-10,"Bridgepoint Education Not Appearing At Senate Hearing (BPI); Trading The Senate Hearing On Bridgepoint Education (BPI, COCO, DV, APOL)",0
ETN,2016-04-29,"Eaton Q1 Operating Earnings Top Expectations, Maintains Full Year Outlook; Eaton Reports Q1 Operating EPS $0.88 vs $0.85 Est., Sales $4.8B vs $4.77B Est.; Earnings Scheduled For April 29, 2016",1
NRG,2016-11-28,"Mid-Afternoon Market Update: Fang Holdings Drops Following Q3 Results; Recro Pharma Shares Surge; Mid-Day Market Update: Crude Oil Up Over 2%; PhaseRx Shares Spike Higher; Mid-Morning Market Update: Markets Open Lower; Edwards Lifesciences To Buy Valtech Cardio; Electric Utilities Up Early: NRG 3%, Companhia Paranaense de Energia 2.5%, Exelon, AES 1.5%, PG&E, Hawaiian Electric 1.5%",2
BCOM,2015-11-09,Benzinga's Top Initiations; Chardan Capital Initiates Coverage on B Communications at Buy,2
G,2013-05-01,"Genpact Limited Sees FY2013 Sales $2.15B-2.20B vs $2.18B Est; Earnings Scheduled For May 1, 2013",1
RLI,2012-11-14,RLI Corp. Declares $5/Share Special Dividend; RLI Corp. Announces Prelim. Pre-Tax Estimate for Losses from Sandy of $15-20M,1
NBL,2017-06-21,Seaport Global Downgrades Noble Energy to Sell; Noble Midstream to Acquire Additional Interests in Delaware Basin and DJ Basin Infrastructure from Noble Energy For $270M,1
EGO,2015-01-12,"Credit Suisse Names Top Picks For Gold Stocks In 2015; Credit Suisse Is Positive On Gold Equities, Lists 4 Stocks To Buy",2
SNV,2011-01-18,"'Mad Money Lightning Round': Shop at Whole Foods; Citigroup, Regionals: Winners & Losers",2
GWPH,2014-05-06,"GW Pharma Shares Move Higher; May be Attributed to Positive Navellier Comments; GW Pharmaceuticals Names Dr. Kenneth Sommerville VP, Clinical Science ",0
PRGS,2016-01-12,"Progress Software Sees FY 2016 Adj EPS $1.59-$1.65 Vs Est $1.56, Revs $427M-$433M vs Est $427.89M; Progress Software Sees Q1 Rev. $92-$94M vs. Est. $97.53M, EPS $0.27-$0.29 vs. Est. $0.30; Progress Software Reports Q4 EPS $0.53 vs. Est. $0.49, Rev. $115.4M vs. Est. $115.96M; Earnings Scheduled For January 12, 2016",0
AEG,2010-11-11,"Aegon Profit Jumps  - Analyst Blog; Market Roundup (AMR, LCC, AEG, OPTC, LONG)",1
RLI,2013-04-23,"UPDATE: Compass Point Initiates RLI Corp. with Neutral on Low Loss Ratio; Compass Point Initiates Coverage on RLI Corp. at Neutral, Announces $65.00 PT",1
STLD,2011-08-24,"On the Wire: Inphi (IPHI) Sharply Lower After Lowering Guidance; Morgan Stanley Downgrades Steel Dynamics To Equal-weight, Lowers PT To $19",1
ADI,2015-02-18,"Stifel Boosts Price Targets For These 5 Stocks; Analog Devices Falls Despite Strong Results, Guidance; What Is Wall Street Expecting?",1
AVY,2017-10-26,"Benzinga's Top Upgrades, Downgrades For October 26, 2017; JP Morgan Downgrades Avery Dennison to Neutral",1
INXN,2016-03-03,"InterXion Holding Shares Trend Lower Despite Earlier Upgrade from Raymond James; Barclays Maintains Overweight on InterXion Holding, Raises PT to $35.00",1
DKS,2015-11-04,"Benzinga's Top Initiations; Barclays Initiates Coverage on Dick's Sporting Goods at Equal-weight, Announces $50.00 PT",0
SYNL,2015-02-19,"UPDATE: The Eastern Co. Shares Down ~$0.60, Synalloy Shares Down ~$0.30 Following Headline of Ended Deal with Synalloy; Synalloy Reports End of Discussions with The Eastern Co., Says Has No Interest in Pursuing Hostile Deal",1
SNY,2015-01-12,"Why The New MannKind Management Could Focus On R&D, Not A Potential Sanofi Merger; From Webcast Presentation: Sanofi M&A Strategy Is Unchanged; Continues Looking For 'Bolt-On Deals;' Not Looking At Sizable Transactions",1
