stock,date,title,label
TM,2011-07-01,"UPDATE: June Toyota US Vehicle Sales Fall 21.1% vs. 13% Est; June Toyota US Vehicle Sales Fall 21.1% vs. 13% Est; Previewing & Trading Today's Economic Reports -July 1, 2011",1
DKS,2014-11-19,"Morgan Stanley Raises Dicks Sporting Goods Price Target; #PreMarket Primer: Wednesday, November 19: Burst Of Cold Creates Chaos In New York",2
BCBP,2017-09-14,"Benzinga's Top Upgrades, Downgrades For September 14, 2017; Keefe Bruyette & Woods Initiates Coverage On BCB Bancorp with Outperform Rating; DA Davidson Initiates Coverage On BCB Bancorp with Buy Rating, Announces $15.00 Price Target",1
ELGX,2013-07-30,"Endologix, Inc. Reports Q2 EPS of $(0.03) vs $(0.06) Est; Revenue of $34.0M vs $33.92M Est; Endologix, Inc. Sees FY2013 Sales $128.0M-134.0M",1
RSPP,2015-08-03,RSP Permian Reports Q2 Rev. $97.11M vs. Est. $87.37M; RSP Permian Raises FY15 Production Outlook by 10%; RSP Permian Reports Q2 EPS $0.16 vs. Est. $0.14; RSP Permian Increases FY15 Outlook,1
RENN,2011-08-11,Renren Reports Q2 EPS $0.00 vs $0.00 Est; Is Angry Birds Leaving Nest to Join Zynga?; Hearing Wedge Partners Making Positive Comments on RenRen Prior to Tonight's Earnings Report,2
CFNB,2017-10-24,"California First National Bancorp Announces Voluntary Delisting From NASDAQ, To Trade OTC; California First National Bancorp Reports Q1 EPS $0.22 vs $0.19 In Same Qtr. Last Year",1
MDCO,2016-12-05,"The Medicines Company Is A Major Cardiovascular Player In The Making; Benzinga's Top Initiations; The Market In 5 Minutes: Gold's New Market, Dakota Pipeline And A Nike Upgrade; H.C. Wainwright Initiates Coverage On The Medicines at Buy, Announces $57.00 Target",1
AT,2017-11-09,"Atlantic Power Reports Q3 EPS $(0.29) vs $(0.69) In Same Qtr. Last Year, Sales $108.6M vs $124.1M Est.; Earnings Scheduled For November 9, 2017",0
DKS,2011-01-13,A Peek into Big 5's 4Q Sales - Analyst Blog; A Peek into Big 5's 4Q Sales - Analyst Blog,1
MDCO,2016-07-19,Medicines Co Spikes Higher on Vol; Option Alert: MDCO Sep16 38.0 Calls Sweep: 800 @  ASK  $2.00: 800 traded vs 0 OI:  Earnings 8/3  $34.46 Ref,1
BTN,2010-10-19,"Increasing Sales and Profit Margins - Screen of the Week; Zacks.com featured expert Kevin Matras highlights: Amtech Systems, Inc., Ballantyne Strong, Inc., Navios Maritime Holdings Inc., SORL Auto Parts, Inc. and Wyndham Worldwide Corp. - Press Releases",0
TM,2012-08-06,Electric Cars Looking for a Spark; Japanese Stocks Rally After Toyota Beats Expectations,1
CHSP,2012-02-09,"UPDATE: Deutsche Bank Raises Target on  Chesapeake Lodgin to $19; JP Morgan Maintains Chesapeake Lodging Trust at Neutral, Raises PT from $14 to $16",1
AZN,2017-02-17,AstraZeneca Reports LYNPARZA Met Primary Endpoint in Phase III Trial in BRCA-Mutated Metastatic Breast Cancer; AstraZeneca Reports Lynparza Meets Primary Endpoint in Phase III Trial in BRCA-Mutated Metastatic Breast Cancer,1
CINF,2011-08-10,"UPDATE: Deutsche Bank Upgrades Cincinnati Financial from Sell to Hold and Lowers PT from $24 to $23; Deutsche Bank Upgrades Cincinnati Financial to Hold, Lowers PT To $23",0
PTR,2012-03-08,"Benzinga's Top ETF Decliners, March 8th (RUSS, TVIX, EDZ); Benzinga's Top ETF Gainers, March 8th (RUSL, EDC, YINN)",1
AZN,2013-08-26,"Benzinga's M&A Chatter for Monday August 26, 2013; Amgen and Onyx Finally Ink Deal Two Months In The Making; AstraZeneca's MedImmune Division to Acquire Amplimmune for up to $500M",1
RENN,2012-05-31,"Benzinga's Morning Upgrade Summary for May 31, 2012; UPDATE: Maxim Group Upgrades Renren to Hold on Price Depreciation  ; Maxim Group Upgrades Renren from Sell to Hold, Removes PT of $4.5",2
MDCO,2014-10-28,"Midday Gainers From October 28: Buffalo Wild Wings, Integrated Device Technology, Cliffs Natural Resources And More; The Medicines Company To Present Results Of Phase III Trial Of Investigational Hemostatic Agent RAPLIXA; Morning Market Movers ; Credit Suisse Maintains Neutral on The Medicines Company, Raises PT to $27.00",2
KAI,2017-10-30,"Kadant Sees Q4 Adj. EPS $1.02-$1.06 vs $1.05 Est., Sales $143M-$146M vs $136M Est.; Kadant Sees FY17 Adj. EPS $4.37-$4.41 vs $4.03 Est.; UPDATE: Kadant Raises FY17 Sales Outlook From $488M-$494M To $509M-$512M vs $490.5M Est.; Kadant Raises Outlook; Kadant Reports Q3 Adj. EPS $1.49 vs $1.14 Est., Sales $153M vs $141.3M Est.",0
AZN,2014-07-29,Citigroup Comments On Potential Pfizer/AstraZeneca Acquisition; Pfizer CEO Says Best to Remain Silent About AstraZeneca Due to UK Takeover Rules -Reuters; Pfizer CEO Says Still Interested In Acquisitions ,1
AZN,2015-07-02,Benzinga's Top Upgrades; Berenberg Upgrades AstraZeneca To  Buy; Berenberg Upgrades AstraZeneca to Buy,1
MUSA,2017-11-07,"Benzinga's Top Upgrades, Downgrades For November 7, 2017; JP Morgan Downgrades Murphy to Underweight",0
GWPH,2016-01-15,"UPDATE: GW Pharma CEO Justin Gover Confirms to Benzinga Trial in Rennes, France that Resulted in 6 Persons Becoming Ill and 1 Coma had No Connection with GW at All, No Implications for the Co; Cramer Shares His Thoughts On J C Penney, Walgreens Boots Alliance, JetBlue Airways And GW Pharmaceuticals; AFP Reports French Health Ministry Denies Rennes Trial Was for a Cannabis-Based Pain Killer; UPDATE: Ouest France Reports via Sky News that the Drug in Rennes Trial Was for a Cannabis-Based Painkiller; Not Linked as of Yet to Any Particular Company",1
HMNY,2016-10-21,"15 Biggest Mid-Day Gainers For Friday; Helios and Matheson Analytics Shares Halted on Second Circuit Breaker, Up 126%; Helios & Matheson Pops to High of $11.38, Up 100%+; Helios and Matheson Analytics Shares Resume Trade Following Circuit Breaker, Now Up ~63.6%",2
EFX,2013-02-08,Equifax Spokesperson Says No Confirmation 60 Minutes Piece will Air this Weekend; Equifax Spikes Lower on Negative 60 Minutes Spot to Appear this Sunday,1
TOL,2012-08-09,"Benzinga's Top Downgrades; UPDATE: JP Morgan Downgrades Toll Brothers to Underweight on Limited Upside  ; JP Morgan Downgrades Toll Brothers from Overweight to Underweight, Raises PT from $30 to $31.50",2
TM,2017-01-31,Automakers Shift Lanes As Disruptive Technologies Take Over; Toyota Begins Using Fuel Cell Forklifts at Motomachi Plant,1
AZN,2016-09-15,What To Watch For In Autozone's Upcoming Earnings Release; Option Alert: AZN Fri 10/28 31.5 Calls (Wkly): 500 @  ASK  $2.65: 3117 traded vs 4001 OI:  Earnings 11/3  $33.54 Ref; Watch These 7 Huge Call Purchases In Thursday Trade,1
AGEN,2014-10-24,Recent SkyNews Headlines Suggesting Pres Obama is Considering Quarantining Health Workers Back from West Africa; NYC Mayor Currently Giving Press Conference on Ebola Case Being 'Under Control',0
EROS,2015-11-12,Eros +8% Premarket Following Press Release; UPDATE: Eros Int'l Release Does Not Address Concern Over 2014/2015 Film Distribution List; Eros Says Content is at the Core of Their Business and Baseless and Misleading Allegations Don't Change Their Fundamentals,2
ADI,2014-08-22,Benzinga Weekly Preview:  Putin And Poroshenko Set To Discuss A Peace Plan; Morgan Stanley Sees Mixed Factors For Analog Devices,1
RGEN,2016-02-25,"Repligen Sees FY16 Sales $93M-$96M vs $93.6M Est., Net Income $15M-$17M, EBITDA $25M-$27M; Repligen Reports Q4 Adj. EPS $0.07, Inline, Sales $21.4M vs $19.8M Est.",1
COF,2011-04-04,"More Customers Exposed as Big Data Breach Grows (C, TIVO, COF, HSNI); Capital One Financial Interested In Buying ING Direct USA (COF, ING)",1
ASR,2010-12-30,OMAB Announces 5-Year Plan - Analyst Blog; OMAB Announces 5-Year Plan - Analyst Blog,1
TM,2016-12-01,"Industry Expert Talks About 3D Printing In Latin America: 'We Want Printers To Supplement Other Machines'; Autodata Reports US Light Auto Sales Totaled 1.38M Units, Up 3.7% YoY, Passenger Car Sales Down 3.1% YoY, Light Truck Slaes Up 8.5%; Automakers In Top Gear As November Sales Accelerate; Toyota Reports Nov. US Auto Sales Up 4.3% YoY",1
SYNL,2014-04-21,Synalloy Reports Adjusted Q1 EPS for Metals Segment at $0.25; Synalloy Metals Segment Reports Q1 2014 EPS $0.20; Revenue of $41.4M,1
GGP,2010-05-07,"General Growth (GGP) Spurns Simon Property (SPG) ; Simon Ups Its Bid For General Growth (SPG, GGP, BAM) ; Simon Property (SPG) Makes A Final Offer Of $20 Per Share For General Growth (GGP)",0
MTOR,2016-05-04,"UPDATE: Meritor Cuts FY16 Sales Outlook from ~$3.4B to ~$3.275B vs $3.33B Est., Adj. EPS from $1.65-$1.75 to $1.55-$1.65 vs $1.60 Est.; Meritor Cuts FY16 Outlook; Meritor Cuts FY16 Outlook; Meritor Reports Q2 Adj. EPS $0.41, Inline Sales $821M vs $831.7M Est.",1
PTR,2016-04-18,PetroChina Shares Indicated Higher Amid BofA's Upgrade To Buy; Benzinga's Top Upgrades; Bank of America Upgrades PetroChina to Buy,2
PRGS,2013-01-03,"Progress Software Corporation Reports Q4 EPS of $0.23 vs $0.34 Est; Revenue of $91.27M, Down 2% YOY; US Stock Futures Down Ahead Of Economic Data; Earnings Scheduled For January 3, 2013",0
BPI,2016-03-08,"Bridgepoint Education Reports Q4 Adj. EPS $0.04 vs $(0.03) Est., Sales $131.4M vs $127.2M Est.; Earnings Scheduled For March 8, 2016",0
MBUU,2017-09-11,"20 Biggest Mid-Day Gainers For Monday; 7 Biggest Price Target Changes For Monday; Benzinga's Top Upgrades, Downgrades For September 11, 2017; BMO Capital Upgrades Malibu Boats to Outperform, Raises Price Target to $32.00",1
TOL,2015-01-15,Morgan Stanley Mostly Lukewarm On Homebuilders; Morgan Stanley on Homebuilders:,0
HBCP,2016-04-26,Home Bancorp Increases Qtr. Dividend From $0.09 To $0.10/Share; Home Bancorp Reports Q1 EPS $0.47 vs. Est. $0.54,1
ETN,2016-11-01,"Eaton Sees Q4 EPS $1.05 to $1.15 vs $1.18 Est; Eaton Q3 EPS $1.15 vs $1.15 Est, Revenue $5.0B vs $5.1B Est; Earnings Scheduled For November 1, 2016",0
NKTR,2012-11-13,"UPDATE: Bank of America Lowers Nektar Therapeutics PO, Maintains Underperform; Bank of America Maintains Nektar Therapeutics at Underperform, Lowers PT from $7.50 to $7",0
SNY,2017-02-09,"Stay Of Court Injunction A Mild Positive For Regeneron; Regeneron Gets 'Encouraging' Judicial Decision, Could Still Lose Appeal",1
RGS,2015-04-28,"MicroStrategy Reports Q1 EPS $1.79 Vs Est $0.96 May Not Compare, Revs $123.9M Vs Est $135.31M; RingCentral Reports Q1 Adj EPS -$0.09 Vs Est -$0.11, Revs $65.3M Vs Est $50.80M; RingCentral Reports Q1 Adj EPS -$0.09 Vs Est -$0.11, Revs $65.3M Vs Est $64.15",1
NBL,2015-04-22,"Noble Energy Reaches Agreement With Federal And State Regulators To Improve Air Emission Controls In DJ Basin Operations; Noble Energy Announces Agreement With EPA, DoJ, Colorado to Improve Air Emission Controls In DJ Basin; Nomura Initiates Coverage on Noble Energy at Reduce, Announces $48.00 PT",1
NBL,2013-07-26,"Johnson Rice Downgrades Noble Energy to Overweight; Wunderlich Maintains Buy on Noble Energy Inc., Raises undefined to $72.00",1
SSL,2011-01-20,Sasol chucks Indonesian CTL Project - Analyst Blog; Sasol chucks Indonesian CTL Project - Analyst Blog,1
RGEN,2014-06-03,"UPDATE: Repligen Corporation Raises FY2014 Sales Guidance from $52.0M-55.0M to $56.0M-59.0M vs $56.20M Est; Repligen Buys Refine Technology for $20.5Min Cash, 215,285 Shares, Deal Includes Milestone Payment for Up to $8.75M",1
GGP,2015-09-25,REIT ETFs Become Buyback Beneficiaries; Benzinga's Top Upgrades; BMO Capital Upgrades General Growth Properties to Outperform,1
HDP,2015-05-19,"Barclays Upgrades Hortonworks To Overweight; Benzinga's Top Upgrades; Barclays Upgrades Hortonworks to Overweight, Raises PT to $30.00",2
ETN,2010-12-31,"Being Nimble & Disciplined Will Be Key in 2011  12-31-2010; Final Trading Hours of 2010  12-31-2010; Friday's Put/Call Ratio Leaders (FITB, ETN, UTX, JDSU, COH); Puts Purchased on Eaton Corporation (ETN); Top 4 Large-Cap Stocks In Industrial Electrical Equipment Industry With The Highest Cash (ABB, NJ, ETN, ROK)",1
COF,2015-03-17,Analysts Are Revising Estimates At These 3 Credit Card Stocks; Morgan Stanley: Favorable Credit Cycle Continues For Financials,1
ETN,2014-06-05,Hearing Positive Comments from Susquehanna on Meritor Regarding Potential Jury Award Against Eaton; Morgan Stanley Sees Critical Period Approaching For Eaton In Meritor Litigation,1
COF,2011-10-17,"Capital One Earnings Preview: Analysts Expect Rising Revenue, Falling EPS; JP Morgan Reports on Capital One's September Managed Data Release ; Sterne Agee Maintains Neutral Rating and Establishes a $50 PT on Capital One",0
HOS,2011-11-04,"The Run Continues In Hornbeck Offshore; Hornbeck Offshore Services Hits New 52-Week High, $34.82; UPDATE: Jefferies Raises Price Target on Hornbeck Offshore Svcs. to $38; Jefferies Raises PT on Hornbeck Offshore to $38",2
BPI,2016-09-13,"3 Stocks Which Plummeted Three Days On Increasing Volume; With CFBP's Ruling On Bridgepoint, It's Time To Revisit Credit Suisse's Advice",2
PAG,2017-02-07,"Penske Auto Reports Q4 Adj. EPS $0.91 vs $0.88 Est., Sales $4.9B vs $5.01B Est.; Earnings Scheduled For February 7, 2017",0
ADI,2015-05-19,"UPDATE: Analog Devices Expecting Q3 Sales $825M-$865M vs $846M Est.; UPDATE: Analog Devices Sees Q3 Adj EPS $0.71-$0.77; Analog Devices Reports Q2 EPS $0.73 vs. Est. $0.72, Rev. $821M vs. Est. $820.37M; Analog Devices Earnings Preview: Best Quarter In Years?; Earnings Scheduled For May 19, 2015",1
AGEN,2014-07-01,"Morning Market Movers ; UPDATE: Agenus Shares Rise 26% Premarket Following Report of Positive Phase 2 Results; US Stock Futures Gain Ahead Of Manufacturing PMI, Auto Sales; UPDATE: Agenus Announces Positive Phase 2 Results; Agenus Announces Positive Phase 2 Results",0
GGP,2016-05-26,Mizuho's Take On Retail REITs Following ICSC Convention; CEOs Vs. Hedge Fund Managers: Who Gets Paid Better?,1
JWN,2010-12-15,Retail Industry Outlook - Dec. 2010 - Industry Outlook; Retail Industry Outlook - Dec. 2010 - Industry Outlook,1
KEY,2012-07-20,"UPDATE: Jefferies Reiterates Hold Rating, Raises PT on KeyCorp; Jefferies & Company Maintains KeyCorp at Hold, Raises PT from $8.50 to $9",1
WLH,2016-02-25,"William Lyon Homes Reports Q4 EPS $0.68 vs $0.62 Est., Sales $402.982M vs $416M Est.; Earnings Scheduled For February 25, 2016",2
SPB,2013-10-10,"Benzinga's Top Initiations; Jefferies Initiates Coverage on Spectrum Brands Holdings, Inc. at Hold, Announces $69.00 PT",1
GD,2011-02-03,"General Dynamics Board Authorizes Share Repurchase of up to 10M Shares; Alliant's EPS Jumps, Sales Dip - Analyst Blog; Alliant's EPS Jumps, Sales Dip - Analyst Blog",1
AMBC,2016-01-26,Puerto Rico Advisors Expected to Meet with Creditors on Friday -Reuters; Ambac Assurance Settles RMBS Litigation Against JP Morgan for $995M,1
NYCB,2013-03-07,Standpoint Research Upgrades New York Community Bancorp to Buy; Keefe Bruyette & Woods Upgrades New York Community Bancorp to Outperform,1
CJJD,2015-01-08,Morning Market Gainers; China Jo-Jo Drugstores Signed Strategic Service Agreement With Alipay,0
JCI,2010-11-17,Cramer's 'Mad Money' Recap: The New GM (Final); Johnson Controls Increases Dividend 23% to $.16,1
TM,2016-08-02,"Most Automakers Report U.S. Sales Decline During July; The Silver Lining In Ford: Stock Slammed Since Earnings, But Dividend Yield Now Over 5%; Toyota Reports Jul. US Auto Sales Down 1.4%",1
TM,2017-10-03,"Autodata Reporting Sept. US Light-Vehicle Sales Totaled 1.52M Units, Up 6.1% On YoY Basis; General Motors To Give Thrust To Electric Vehicles; Auto Sales Ramp Up In September Buoyed By Labor Day Boost; Toyota Reports U.S. Sales In September 14.9% YoY",1
WNS,2011-01-19,"Steady Quarter For WNS, Jefferies Finds Attractive; Piper Jaffray Downs WNS To Neutral; Piper Jaffray Downgrades WNS Holdings To Neutral",0
NRG,2016-05-05,"NRG Energy Reaffirms FY16 Outlook: Adj. EBITDA $3B-$3.2B; NRG Energy Reports Q1 Adj. EBITDA $812M, Sales $3.229B vs $3.26B Est.; Earnings Scheduled For May 5, 2016",1
BPL,2016-02-25,"5 MLPs To Buy And 4 To Sell; Morgan Stanley Initiates Coverage on Buckeye Partners at Overweight, Announces $69.00 PT; Morgan Stanley Initiates MLPs: BPL, CPPL, DM, PSXP, VLP At Overweight & ENBL, EEP, EEQ, MEP At Underweight",2
NRG,2016-10-10,"NRG Energy Inc Shares Spiking Higher, Up 3.55% Today; Option Alert: NRG Jan17 12.0 Calls: 3600 @  Above Ask!  $0.93: 4300 traded vs 1573 OI:  Earnings 11/2  $11.31 Ref",2
PERY,2011-08-18,"Earnings Roundup; Benzinga's Top Pre-Market Gainers; UPDATE: Perry Ellis Swings To Q2 Profit, Lifts Forecast; Perry Ellis International Reports Q2 EPS $0.11 vs $0.04 Est; Revenues $214.4M vs $203.95M Est		",2
SPB,2014-12-01,"Spectrum Brands Prices $250M Senior Notes Offering; Spectrum Brands Announces Intention To Offer $250M In Senior Notes, Enter Into A New Term Loan Facility",1
TM,2012-10-04,"Territorial Disputes Taking Toll on Japanese Economy; Amid Increased Sales Globally, Toyota Plant Strikes in South Africa",1
CSV,2014-03-05,"Carriage Services, Inc. Sees FY2015 EPS $1.42-0.48; Sees Sales $254.0M-262.0M; Carriage Services, Inc. Sees FY2014 EPS $1.18-1.22; Sees Sales $231.0M-235.0M",1
ADI,2015-08-20,"Benzinga's Top Downgrades; Nomura Downgrades Analog Devices to Reduce, Lowers PT to $53.00",0
IVZ,2013-01-14,"7 Stocks to Watch Next Week; UPDATE: JP Morgan Downgrades Invesco to Neutral on Valuation, Performance Moderation  ; JP Morgan Downgrades Invesco Plc to Neutral, Lowers PT to $31.00",1
JCI,2017-03-20,"7 Biggest Price Target Changes For Monday; Oppenheimer Issues Monthly Top Ideas Mar-Apr; Added Home Depot, CIT Group, Cigna, Aqua Metals, Silver Spring Networks, NCR, & Pandora; Removed Costco, Leucadia National, Envision Healthcare, Trimble, Johnson Controls, Facebook, & Spectrum Brands; Benzinga's Top Upgrades, Downgrades For March 20, 2017; Susquehanna Upgrades Johnson Controls International To Positive, Raises Price Target To $49",1
MTOR,2017-09-05,"Buckingham Initiates Coverage On Meritor with Buy Rating, Announces $25.00 Price Target; Meritor Announces Acquisition of Product Portfolio and Technologies of Fabco Holdings, Terms Not Disclosed; Watch These 7 Huge Call Purchases In Tuesday Trade",1
TST,2012-03-07,TheStreet Reports Q4 EPS $(0.08); Revs $14.3M; Elisabeth DeMarse Named CEO and President of TheStreet ,2
TM,2010-02-05,Toyota Motors Struggles To Repair Faults With Its Various Automobiles (TM); Standpoint Says Toyota Sell Off Overdone (TM),2
EFX,2017-11-03,"UPDATE: Equifax Says 'none of the four executives engaged in insider trading'; UPDATE: Equifax Says 'none of the four executives had knowledge of the incident when their trades were made, that preclearance for the four trades was appropriately obtained, that each of the four trades at issue comported with Company policy'; Equifax Board Issues Findings Of Special Committee Related To Stock Sale By Execs",0
PERY,2017-03-22,"A Peek Into The Markets: U.S. Stock Futures Down Ahead Of Existing-Home Sales Report; Perry Ellis Sees FY18 Adj. EPS $2.07-$2.17 vs $2.16 Est., Sales $870M-$880M vs $908.7M Est.; Perry Ellis Reports Q4 Adj. EPS $0.66 vs $0.60 Est., Sales $204M vs $229.6M Est.; 8 Stocks To Watch For March 22, 2017; Earnings Scheduled For March 22, 2017",0
AMBC,2014-10-13,"Ambac Reports Will Redeem Portion of Surplus Notes One Month Earlier Than Expected; Option Alert: Ambac Feb $22.5 Call; 3,000 Contract Trade at Ask @$1.50; Currently $20.05",0
KEY,2013-04-18,"KeyCorp Reports Q1 EPS of $0.21 vs $0.20 Est; Revenue of $196.0M vs $1.05B Est; US Stock Futures Up Ahead Of Weekly Jobless Claims Data; Earnings Scheduled For April 18, 2013",0
TST,2014-10-07,UPDATE: TheStreet Will Buy BoardEx for $21M; TheStreet Will Buy BoardEx for $21M,2
AZN,2015-12-07,"These Currency Hedged ETFs Could Enjoy 2016; UPDATE: Celgene, Astrazeneca Fusion Program Partnership Is To Develop & Commercialize durvalumab Across A Range Of Blood Cancers; Celgene, Astrazeneca Report Start Of Fusion Clincial Development Program In Immuno-Oncology",1
NM,2011-08-22,Navios Maritime Holdings Reports Reports Q2 EPS $0.12 vs $0.17 Est; Revenues $165.35M vs $151.99M Est	; US Stock Futures Signal Higher Start On Wall Street ; Earnings Scheduled For August 22; Stocks To Watch For August 22,0
CNX,2013-03-11,"A Coal Stock Pair Trade for Monday; UPDATE: BMO Capital Markets Upgrades CONSOL Energy to Outperform on Balance Sheet Strength; BMO Capital Upgrades CONSOL Energy Inc. to Outperform, Raises PT to $42.00",1
MINI,2010-05-06,"Top Narrow Based Indexes For May 6 (SXCI, MINI, TRE); Benzinga’s Top Upgrades (CBR, CKP, MINI, ADCT, HOLX)",0
HDP,2015-06-17,"Benzinga's Top Initiations; Mizuho Securities Initiates Hortonworks With Buy; Mizuho Securities Initiates Coverage on Hortonworks at Buy, Announces $31.00 PT",1
NBL,2010-11-18,Noble Stacks 10 More Rigs - Analyst Blog; Noble Stacks 10 More Rigs - Analyst Blog,1
MDCO,2014-04-30,"UPDATE: FDA Says Medicines Co.'s Cangrelor NDA Comments May Affect Labeling; The Medicines Co. Announces CRL from FDA, Requests Added Info",2
NRG,2017-08-10,"NRG Energy Shares Turn Positive, Now Up 1% Amid Report Co. Considering Selling As Much As $4B In Assets; NRG Energy Shares Moving Higher; 13G/A Shows T Rowe Price Reporting 10.6% Stake",1
NAV,2012-12-18,A Peek Into The Market Before The Trading Starts; Mahindra To Acquire Navistar's Stake in Mahindra Navistar Automotives and Mahindra Navistar Engines,2
SNY,2016-02-09,Sanofi's Stock Dips Lower Following Q4 Print; Sanofi Reports Q4 Rev €9.28B Vs. €9.07B; Increases Dividend to €2.93 from €2.85,1
ETN,2017-04-04,"Benzinga's Top Upgrades, Downgrades For April 4, 2017; Longbow Research Upgrades Eaton Corporation To Buy",1
DKS,2012-06-12,"Dick's Sporting Goods, Polypore to Present at William Blair Growth Stock Conference at 1:00pm; Bank of America Removes Dick's Sporting Goods from US 1 List; Bank of America Removes Dick's Sporting Goods from US 1 List",2
ACC,2017-07-24,"American Campus Communities Sees FY17 FFO $2.34-$2.44; American Campus Communities Reports Q2 FFO $0.50 vs $0.54 In Prior Year Period, Sales $179M vs $171M Est.",1
DKS,2014-02-10,"Market Wrap For February 10: Markets Cautious Ahead Of Yellen Testimony; Benzinga's Volume Movers; Shares of Dicks up 7% Pre-Market: Company Reports 7% Comps in Q4, Raised Outlook; UPDATE: Dick's Sporting Goods Inc Raises Q4 EPS Guidance from $1.04-1.07 to $1.10-1.11 vs $1.06 Est; Dick's Raises Outlook, Sees Better-Than-Expected Q4 Comps",0
WNS,2013-04-18,"William Blair Upgraded WNS (Holdings) Limited to Outperform; Deutsche Bank Maintains Buy on WNS (Holdings) Limited, Raises PT to $19.00",1
FISV,2014-04-29,"Fiserv, Inc. Sees FY2014 EPS $3.28-3.37 vs $3.33 Est; Fiserv, Inc. Reports Q1 EPS of $0.82 vs $0.74 Est; Revenue of $1.23B vs $1.21B Est",1
RENN,2016-05-20,Mid-Afternoon Market Update: New York & Company Falls On Weak Results; InterOil Shares Spike Higher; Mid-Day Market Update: Applied Materials Gains Following Earnings Beat; DryShips Shares Slide; Mid-Morning Market Update: Markets Open Higher; Foot Locker Posts In-Line Q1 Earnings,2
GGP,2013-02-04,"General Growth Properties, Inc. Sees FY2013 FFO $1.08-1.12 vs $1.08 Est; General Growth Properties Raises Qtr. Dividend from $0.11 to $0.12/Share; General Growth Properties, Inc. Sees Q1 FFO $0.24-0.26 vs $0.24 Est; General Growth Properties, Inc. Reports Q4 FFO of $0.31 vs $0.29 Est",1
RLJ,2011-06-21,RLJ Lodging Trust Completes New $300M Unsecured Revolving Credit Facility   ; UPDATE: KeyBanc Initiates RLJ Lodging Trust at Hold; KeyBanc Initiates RLJ Lodging At Hold,1
GWPH,2017-02-24,"Marijuana Stocks Are Having A Great 2017, Despite Sean Spicer's Comments; Up In Smoke? DoJ Will 'Take Action' Against States That Have Legalized Marijuana",1
TM,2015-01-06,Edmunds.com Analyst: Auto Sales Can't Continue To Grow In This Way; Toyota Allows Royalty-Free Use of Fuel Cell Vehicle Patents,1
TOL,2017-06-14,Benzinga's Option Alert Recap From June 14; Option Alert: Toll Bros  Jul 39.0 Calls: 3500 @  ASK  $0.90: 3502 traded vs 166 OI:  Earnings 8/22 Before Open (est)  $38.83 Ref,1
MDCO,2015-11-04,"Chardan: Time To Buy The Medicines Co.; Benzinga's Top Initiations; Chardan Sees Promise Of ALN-PCSsc, Initiates The Medicines Co. With Buy; Chardan Capital Initiates Coverage on The Medicines Company at Buy, Announces $50.00 PT",1
VNOM,2014-09-03,Benzinga's Top Initiations; Tudor Pickering Initiates Viper Energy At Accumulate; Tudor Pickering Initiates Coverage on Viper Energy Partners LP at Accumulate,1
RENN,2016-06-08,"Renren Q1 EPS ($0.07) vs ($0.07) Prior, Revenue $10.8M; Earnings Scheduled For June 8, 2016",1
MKC,2013-09-18,"UPDATE: Deutsche Bank Lowers PT on McCormick & Company on Investor Concerns, High-Margin Consumer Strength; Deutsche Bank Maintains Buy on McCormick & Company, Incorporated, Lowers PT to $76.00",1
NBL,2012-07-27,"UPDATE: Deutsche Bank Lowers PT on Noble Energy from $118 to $115; Deutsche Bank Maintains Noble Energy at Buy, Lowers PT from $118 to $115",2
MDCO,2016-02-03,The Medicines Company Appoints Sarissa Capital Management Exec To Its Board Of Directors; The Medicines Company Appoints Alexander J. Denner To Board,2
PAG,2011-07-27,Puts Purchased on Penske Automotive Group; Stocks to Watch for Wednesday 7/27/2011: Fresh 52 Week Highs and Lows,0
PERY,2014-02-25,"Stocks Hitting 52-Week Lows; Perry Ellis Preliminary Q4 Earnings Disappoint, Shares Tumble",1
SNY,2011-01-14,Genzyme Cuts 2011 Outlook - Analyst Blog; Genzyme Cuts 2011 Outlook - Analyst Blog; Top 10 Warren Buffett Dividend Stocks,1
STRA,2013-07-26,"UPDATE: BMO Capital Markets Lowers PT on Strayer Education Following 2Q13 Results Report; BMO Capital Maintains Market Perform on Strayer Education, Inc., Lowers PT to $40.00",1
CMCO,2013-07-26,"CJS Securities Downgrades Columbus McKinnon Corporation to Market Perform, Removes $25.00 PT; Columbus McKinnon Corporation Reports Q1 EPS of $0.35 vs $0.33 Est; Revenue of $138.90M vs $149.55M Est",0
NAV,2017-03-08,"The Market In 5 Minutes; Benzinga's Top Upgrades, Downgrades For March 8, 2017; Stifel Nicolaus Upgrades Navistar International To Hold",1
AZN,2016-06-09,"Benzinga's M&A Chatter for Thursday June 9, 2016; StreetSweeper On Relypsa: 8 Reasons 'We Wouldn't Run Away & Join This Circus'; Aspen to Acquire Commercialization Rights to Astrazeneca's Anaesthetic Medicines Portfolio for $520M Upfront Payment",1
